{"artifacts":[{"artifactId":"reference-deliverable","digest":{"algorithm":"sha-256","value":"f911b962ff89233ef3dd9e908ab1be39d9615016835995f71b97d20fe9714baa"},"mediaType":"application/json","path":"evidence/deliverable.json","role":"DELIVERABLE","sizeBytes":248,"source":{"authorityStatus":"FORMALLY_DEFINED","controllerRelationship":"INTERNAL_FIXTURE","derivation":"GENERATED","observationMode":"SYNTHETIC","originAuthentication":"SYNTHETIC","role":"REFERENCE_FIXTURE","systemId":"evaldossier-reference-fixture"}},{"artifactId":"reference-deliverable-schema","digest":{"algorithm":"sha-256","value":"11a39e270ae164b77ae6c7054baae2b0592921be17a3c3449281b36e1aa3111f"},"mediaType":"application/schema+json","path":"evidence/deliverable.schema.json","role":"SCHEMA","sizeBytes":787,"source":{"authorityStatus":"FORMALLY_DEFINED","controllerRelationship":"INTERNAL_FIXTURE","derivation":"GENERATED","observationMode":"SYNTHETIC","originAuthentication":"SYNTHETIC","role":"REFERENCE_FIXTURE","systemId":"evaldossier-reference-fixture"}}],"bundleId":"reference-evidence-bundle-v0","captureMode":"GENERATED_SYNTHETIC","capturedAt":"2026-07-21T12:00:01Z","collector":{"id":"evaldossier-demo-requester","key":{"alg":"EdDSA","crv":"Ed25519","kid":"d4UhSQNrYau1lQItySj4mMqmaSNejGXcXQz2FD0x7kI","kty":"OKP","use":"sig","x":"1087eeo8BF1sZIl0ZNs5qe6A0zkZL4c9Kmlh0R3DJgc"}},"limitations":["Both artifacts are public synthetic fixtures generated for the local demo.","Fixture provenance does not establish external adoption, neutrality, or commercial authority."],"proof":{"jws":"eyJhbGciOiJFZERTQSIsImtpZCI6ImQ0VWhTUU5yWWF1MWxRSXR5U2o0bU1xbWFTTmVqR1hjWFF6MkZEMHg3a0kiLCJ0eXAiOiJldmFsZG9zc2llci5ldmlkZW5jZS1idW5kbGUvMC4xIn0..aQ4hs852xfRrNSLOWoI0Cje8niTJe48eCAxAARwNHLJz7zKjrpspsFmsxNRPJ6Izinr1DsUr7uwiYg_zoeoWCw","type":"evaldossier.detached-jws/0.1"},"protocolVersion":"evaldossier/0.1","requestId":"reference-evaluation-request-v0","schemaVersion":"evaldossier.evidence-bundle/0.1","signatureContext":{"audience":"evaldossier-offline-demo","nonce":"reference-evidence-nonce-0001"},"signingKeyId":"d4UhSQNrYau1lQItySj4mMqmaSNejGXcXQz2FD0x7kI"}