{"artifacts":[{"artifactId":"synthetic-model-request","digest":{"algorithm":"sha-256","value":"48b4187cab1d88d71b73e51d368bb1396b0b5a2b992be8f943238a7f56fcd1ad"},"mediaType":"application/json","path":"evidence/model-request.json","role":"UPSTREAM_REQUEST","sizeBytes":410,"source":{"authorityStatus":"NON_AUTHORITATIVE","controllerRelationship":"INTERNAL_FIXTURE","derivation":"GENERATED","observationMode":"SYNTHETIC","originAuthentication":"SYNTHETIC","role":"REFERENCE_FIXTURE","systemId":"evaldossier-synthetic-model-fixture"}},{"artifactId":"synthetic-model-response","digest":{"algorithm":"sha-256","value":"70dc12ef30e529fe011bea434722cf0382c38ab19bc374f77a2e13f499fd0ca7"},"mediaType":"application/json","path":"evidence/model-response.json","role":"UPSTREAM_RESPONSE","sizeBytes":1445,"source":{"authorityStatus":"NON_AUTHORITATIVE","controllerRelationship":"INTERNAL_FIXTURE","derivation":"GENERATED","observationMode":"SYNTHETIC","originAuthentication":"SYNTHETIC","role":"REFERENCE_FIXTURE","systemId":"evaldossier-synthetic-model-fixture"}},{"artifactId":"synthetic-model-rubric","digest":{"algorithm":"sha-256","value":"ceae88238630ead210843c52c24cc4ae0af1a34d432e62df11889db3fe804ef9"},"mediaType":"application/json","path":"evidence/model-rubric.json","role":"POLICY","sizeBytes":412,"source":{"authorityStatus":"NON_AUTHORITATIVE","controllerRelationship":"INTERNAL_FIXTURE","derivation":"GENERATED","observationMode":"SYNTHETIC","originAuthentication":"SYNTHETIC","role":"REFERENCE_FIXTURE","systemId":"evaldossier-synthetic-model-fixture"}}],"bundleId":"synthetic-model-judgment-evidence-v0","captureMode":"GENERATED_SYNTHETIC","capturedAt":"2026-07-21T12:10:01Z","collector":{"id":"evaldossier-demo-requester","key":{"alg":"EdDSA","crv":"Ed25519","kid":"jS2ThTJOhPijNtZ5mkMKoQFdEeMtBFmYFuUTBsEOEb4","kty":"OKP","use":"sig","x":"A783NVGM60KSfyMLFn7puJpkUiFHvBVu_95mc8hzDW0"}},"limitations":["Every source artifact is generated by this project and represents no external evaluator or production event.","The fixture demonstrates type-preserving normalization, not model quality, origin, adoption, or demand."],"proof":{"jws":"eyJhbGciOiJFZERTQSIsImtpZCI6ImpTMlRoVEpPaFBpak50WjVta01Lb1FGZEVlTXRCRm1ZRnVVVEJzRU9FYjQiLCJ0eXAiOiJldmFsZG9zc2llci5ldmlkZW5jZS1idW5kbGUvMC4xIn0..OOoomFnI4nqH3KbT59AZsMwN7-QnJfP84RUmMnuYik_aIcnc--11wZ5rFjDP3DZoq20MJ-Og5EiMa8YxfZg3Bg","type":"evaldossier.detached-jws/0.1"},"protocolVersion":"evaldossier/0.1","requestId":"model-judgment-normalization-request-v0","schemaVersion":"evaldossier.evidence-bundle/0.1","signatureContext":{"audience":"evaldossier-offline-demo","nonce":"model-judgment-evidence-nonce-0001"},"signingKeyId":"jS2ThTJOhPijNtZ5mkMKoQFdEeMtBFmYFuUTBsEOEb4"}